	title	lead	section_tag	Alternative_text	Image_url	date	body	editor
140	Πόλεμος στην Ουκρανία: Πώς οι Ρώσοι έκαναν την Αζοφική θάλασσα ρωσική λίμνη 	Η Ρωσία επικεντρώνεται στον έλεγχο της νοτιανατολικής Ουκρανίας καθιστώντας την Αζοφική θάλασσα ρωσική λίμνη. Δείτε το σχετικό χάρτη. 	                        ΚΟΣΜΟΣ	Πλατφόρμα στο λιμάνι της Μαριούπολης 	https://www.news247.gr/img/4071/9607519/624000/w660/660/azovsea1.jpg	2022-04-24 11:50	"Oταν η Ρωσία άρχισε την ""ειδική στρατιωτική επιχείρηση"", την εισβολή δηλαδή στην Ουκρανία, παρουσίασε ως κύριο λόγο της επέμβασης την αποναζιστικοποίηση της Ουκρανίας και την προστασία των ρωσόφωνων στο Ντονμπάς. Χωρίς να ισχυρίζεται κανείς ότι οι παραπάνω δεν αποτελούν λόγους, είναι σαφές (και γινέται και ολοένα περισσότερο ξεκάθαρο τις τελευταίες ημέρες) ότι οι Ρώσοι επενέβησαν και σκόρπισαν τον όλεθρο παραβιάζοντας κάθα έννοια διεθνούς δικαίου κυρίως για να ελέγξουν τους διαδρόμους της Αζοφικής θάλασσας την οποία ουσιαστικά θέλουν για αποκλειστική χρήση. Οπως φαίνεται από τον επικαιροποιημένο χάρτη που δημοσιεύει το βρετανικό υπουργείο άμυνας, οι Ρώσοι επικεντρώνουν το ενδιαφέρον τους στη νοτιοανατολική Ουκρανία μέχρι τη γραμμή της Χερσώνας και του Μικολάιβ στο νότο. Οι περιοχές που παρουσιάζονται με ροζ χρώμα φέρεται να ελέγχονται πλήρως ή σχεδόν πλήρως από τη Ρωσία. Από το κομβικής σημασίας για την τοπική οικονομία λιμάνι της Μαριούπολης και πιο δυτικά μέχρι τη Μελιτόπολη και εν συνεχεία τη χερσόνησο της Κριμαίας (η οποία αποτελεί ρωσικό έδαφος από το 2014) οι Ρώσοι έχουν καταφέρει με αίμα αθώων να καταστήσουν την Αζοφική θάλασσα ρωσική λίμνη με ότι αυτό συνεπάγεται για την εν γένει κυριαρχία στην περιοχή. Πριν από την επέμβαση της 24ης Φεβρουαρίου, η Αζοφική, περίκλειστη θάλασσα, μοιραζόταν μεταξύ Ουκρανίας (στις δυτικές ακτές) και της Ρωσίας (στις ανατολικές). Πλέον η Ρωσία ελέγχει το σύνολο της Αζοφικής θάλασσας σε νότο, βορρά, δύση και ανατολή αφήνοντας στην Ουκρανία ακτές μόνο στη Μαύρη Θάλασσα. Προσώρας οι Ρώσοι, αν και χτυπούν παντού, δεν ελέγχουν την Οδησσό (αν και την χτύπησαν με πυραύλους το Σάββατο, κατά ουκρανικές πηγές) αλλά ούτε και το Μικολάιβ, παρά το λουτρό αίματος. Σύμφωνα πάντα με το χάρτη παλεύουν για τη Χερσώνα και έχουν στραμμένη την προσοχή τους και στις περιοχές στις οποίες καταλήγει ο μεγάλος ποταμός Δνείπερος. Τα χτυπήματα πλέον στην υπόλοιπη ουκρανική επικράτεια (από τη δύση, στο Λβιβ, μέχρι και το Κίεβο) χρησιμεύουν στο να κρατούν καθηλωμένες τις ουκρανικές δυνάμεις έτσι ώστε να μην ενισχύεται η αντίσταση στα νοτιανατολικά. Ηταν αυτό που ήθελε εξ αρχής ο Πούτιν; Δύσκολο να το πει κάποιος. Ο Ρώσος πρόεδρος μιλούσε ακόμα και για αλλαγή κυβέρνησης στο Κίεβο (υπονοώντας ότι προκρίνει λύση ρωσόφιλου κυβερνητικού σχήματος) ωστόσο η αποτελεσματική και γενναία αντίσταση που συνάντησε προφανώς τον έκανε να αναθεωρήσει τα σχέδιά του. Ακόμα όμως και τα εδάφη που έχει ήδη ελέγξει, καθιστούν, στη θεωρία πάντα (κανείς δεν ξέρει σε ποια οικονομική κατάσταση θα βρίσκεται η Ρωσία βγαίνοντας από τον πόλεμο) τη χώρα του ακόμα πιο ισχυρή γεωπολιτικά και σίγουρα πιο μεγάλη. Το κόστος βέβαια σε ανθρώπινες ζωές είναι τέραστιο ενώ η Ρωσία θα έχει πια να αντιμετωπίσει μία Δύση η οποία θα είναι πλήρως υποψιασμένη για το γεγονός ότι ο Πούτιν μπορεί άνετα να ερμηνεύει το Διεθνές Δίκαιο κατά το δοκούν. Ακολουθήστε το News247.gr στο Google News και μάθετε πρώτοι όλες τις ειδήσεις"	                        Νίκος Γιαννόπουλος
141	"Τουρκία: ""Μπλόκο"" σε αεροσκάφη που μεταφέρουν στρατιώτες από τη Ρωσία στη Συρία"	Κατόπιν διαβουλεύσεων με τη Μόσχα, η Τουρκία έκλεισε τον εναέριο χώρο της σε αεροσκάφη που μεταφέρουν στρατιώτες από τη Ρωσία στη Συρία.	                        ΚΟΣΜΟΣ	Ρωσικό αεροσκάφος	https://www.news247.gr/img/2417/9607820/454000/w660/660/rosia.jpg	2022-04-23 21:46	"Η Τουρκία έκλεισε τον εναέριο χώρο της στα ρωσικά αεροσκάφη που μεταφέρουν στρατεύματα προς τη Συρία, έπειτα από διαβουλεύσεις με τη Μόσχα, μετέδωσαν σήμερα τουρκικά ΜΜΕ, επικαλούμενα τον Τούρκο υπουργό Εξωτερικών Μεβλούτ Τσαβούσογλου. ""Κλείσαμε τον εναέριο χώρο στα στρατιωτικά αεροσκάφη της Ρωσίας και επίσης στα πολιτικά αεροσκάφη με προορισμό τη Συρία που μεταφέρουν στρατιώτες"", δήλωσε ο Τσαβούσογλου, χωρίς να διευκρινίσει το κίνητρο αυτής της απόφασης. Ο Τούρκος ΥΠΕΞ δήλωσε πως ενημέρωσε για την απόφαση αυτή τον Ρώσο ομόλογό του Σεργκέι Λαβρόφ, ο οποίος θα ενημερώσει με τη σειρά τον Βλαντίμιρ Πούτιν. Η απόφαση θα ισχύει για τρεις μήνες, διευκρίνισε ο Τσαβούσογλου. Ακολουθήστε το News247.gr στο Google News και μάθετε πρώτοι όλες τις ειδήσεις"	news247
142	Κρήτη: Στη φετινή Ανάσταση αντί για τον Ιούδα θα κάψουν τον Πούτιν	"Στη ""σκιά"" του πολέμου στην Ουκρανία, οι κάτοικοι στις Στέρνες Χανίων επέλεξαν φέτος να κάψουν τον Πούτιν αντί για τον... πατροπαράδοτο Ιούδα."	                        ΚΟΙΝΩΝΙΑ	Η καύση του Πούτιν	https://www.news247.gr/img/8035/9607722/422000/w660/660/putin-kriti.jpg	2022-04-23 21:43	"""Κόντρα"" στα καθιερωμένα έθιμά τους πάνε φέτος οι κάτοικοι στις Στέρνες Χανίων, αφού επέλεξαν αντί για τον Ιούδα, όπως κάνουν κάθε χρόνο, να κάψουν τον Βλαντίμιρ Πούτιν. Πιο συγκεκριμένα, σύμφωνα με το zarpanews, οι Κρητικοί επέλεξαν να ""παρακάμψουν το έθιμο που αναβιώνει για παραπάνω από 50 χρόνια και, επηρεασμένοι από τον πόλεμο στην Ουκρανία, στη φετινή Ανάσταση θα κάψουν τον Ρώσο πρόεδρο. Δεν είναι η πρώτη φορά που... αφήνουν στην άκρη τον Ιούδα, αφού παλαιότερες χρονιές είχαν κάψει -μεταξύ άλλων- τον Αντώνη Σαμαρά και τον Ευάγγελο Βενιζέλο. Ακολουθήστε το News247.gr στο Google News και μάθετε πρώτοι όλες τις ειδήσεις"	news247
143	Πόλεμος στην Ουκρανία: Στο Κίεβο την Κυριακή ο Μπλίνκεν - Το μήνυμα Ζελένσκι στον Πούτιν	Η πρώτη επίσημη επίσκεψη εκπροσώπων της αμερικανικής κυβέρνησης στην Ουκρανία, δύο μήνες μετά την έναρξη του πολέμου. Τι διαμηνύει ο Βολοντίμιρ Ζελένσκι στον Βλαντίμιρ Πούτιν.	                        ΚΟΣΜΟΣ	Βολοντίμιρ Ζελένσκι	https://www.news247.gr/img/2622/9607805/368000/w660/660/zelenskyy.jpg	2022-04-23 21:25	Στο Κίεβο θα μεταβεί αύριο, Κυριακή του Πάσχα (25/04), ο επικεφαλής του Στέιτ Ντιπάρτμεντ Άντονι Μπλίνκεν, όπως ανακοίνωσε ο πρόεδρος της Ουκρανίας Βολοντίμιρ Ζελένσκι, σε συνέντευξη Τύπου που παραχώρησε στο εσωτερικό ενός σταθμού του μετρό, στο κέντρο της ουκρανικής πρωτεύουσας. «Αύριο, Αμερικανοί αξιωματούχοι θα μεταβούν στη χώρα μας: Θα συναντηθώ με τον υπουργό Άμυνας (Λόιντ Όστιν) και τον Άντονι Μπλίνκεν», δήλωσε ο Ζελένσκι. Σημειώνεται πως είναι η πρώτη επίσημη επίσκεψη εκπροσώπων της αμερικανικής κυβέρνησης στην Ουκρανία, που θα γίνει ακριβώς δύο μήνες μετά την έναρξη της ρωσικής εισβολής στις 24 Φεβρουαρίου. Ερωτηθείς από το Γαλλικό Πρακτορείο, ένας εκπρόσωπος τύπου του Στέιτ Ντιπάρτμεντ δεν θέλησε να σχολιάσει σχετικά. Ο Ζελένσκι εξέφρασε, επιπλέον, την ελπίδα ότι ο Αμερικανός ομόλογός του Τζο Μπάιντεν θα μπορούσε επίσης «να έρθει να στηρίξει τον ουκρανικό λαό» στο Κίεβο, όταν η κατάσταση ασφαλείας το επιτρέψει. Διευκρίνισε πως οι συνομιλίες αύριο θα επικεντρωθούν στην παράδοση αμερικανικών όπλων στην Ουκρανία. «Την προηγούμενη εβδομάδα, οι ενδείξεις, τα μηνύματα, τα βήματα, οι προθεσμίες, οι αριθμοί- μιλάω για όπλα των ΗΠΑ, όλα βελτιώθηκαν», είπε με ικανοποίηση ενώπιον δημοσιογράφων, τονίζοντας πως είναι «ευγνώμων» προς την αμερικανική διοίκηση, ακόμα κι αν θα ήθελε «βαρύτερα και ισχυρότερα όπλα για να αντιμετωπίσει τον ρωσικό στρατό». Εξάλλου, όπως είπε, η Ουκρανία θέλει οι ΗΠΑ να συμφωνήσουν να είναι μία από τις εγγυήτριες χώρες ασφαλείας προκειμένου να την προστατεύσουν από μελλοντικές απειλές. Κατά τη διάρκεια της συνέντευξης τύπου που παραχώρησε στο Κίεβο, σημείωσε ότι αναμένει οι ΗΠΑ να μιλήσουν με τη Γερμανία σχετικά με την προμήθεια όπλων στην Ουκρανία Το μήνυμα του Ζελένσκι στον Πούτιν Ο πρόεδρος της Ουκρανίας Βολοντίμιρ Ζελένσκι τάχθηκε εκ νέου υπέρ του να συναντηθεί με τον Ρώσο ομόλογό του Βλαντίμιρ Πούτιν «προκειμένου να τερματιστεί ο πόλεμος». «Πιστεύω πως εκείνος που ξεκίνησε αυτόν τον πόλεμο μπορεί να βάλει ένα τέλος σε αυτόν», είπε ο Ζελένσκι, κατά τη διάρκεια της συνέντευξης τύπου, επαναλαμβάνοντας πως «δεν φοβάται να συναντήσει (τον Πούτιν)», εάν αυτό θα βοηθήσει στο να επιτευχθεί μια ειρηνευτική συμφωνία μεταξύ της Ρωσίας και της Ουκρανίας. Επιπλέον, ο Βολοντίμιρ Ζελένσκι είπε ότι το Κίεβο θα αποχωρήσει από τις διαπραγματεύσεις με τη Μόσχα, εάν οι στρατιωτικοί του που έχουν καταφύγει σε ένα τεράστιο βιομηχανικό συγκρότημα στο Αζοφστάλ, στη Μαριούπολη, στη νοτιοανατολική Ουκρανία, σκοτωθούν από τον ρωσικό στρατό. «Εάν οι άνδρες μας σκοτωθούν στη Μαριούπολη και εάν ψευδο-δημοψηφίσματα διοργανωθούν στην περιοχή της Χερσώνας (νότια), τότε η Ουκρανία θα αποσυρθεί από κάθε διαδικασία διαπραγματεύσεων», τόνισε ο Ζελένσκι από το Κίεβο. Τέλος, ο πρόεδρος της Ουκρανίας Βολοντόμιρ Ζελένσκι δήλωσε πως πιστεύει ότι η Ρωσία θα μπορούσε να κάνει χρήση ενός πυρηνικού όπλου, όμως δεν θέλει να πιστέψει ότι θα το έκανε. Ακολουθήστε το News247.gr στο Google News και μάθετε πρώτοι όλες τις ειδήσεις	news247
144	Πορτρέτο του Πούτιν με εικόνες του πολέμου στην Ουκρανία	"Λευκορώσος φωτογράφος δημιούργησε ένα πορτρέτο του Πούτιν από 1.500 στιγμιότυπα οθόνης και φωτογραφίες, σε μια ""σύνθεση"" που ""δείχνει"" τον αυτουργό του πολέμου στην Ουκρανία."	                        ΚΟΣΜΟΣ	Ο Βλαντίμιρ Πούτιν	https://www.news247.gr/img/118/9607707/141000/w660/660/putin.jpg	2022-04-23 19:51	"Ο Λευκορώσος φωτογράφος Pavel Krychko δημιούργησε ένα πορτρέτο του Ρώσου Προέδρου Βλαντίμιρ Πούτιν από 1.500 φωτογραφίες που τραβήχτηκαν κατά τη διάρκεια του πολέμου στην Ουκρανία. Στο εν λόγω πορτρέτο αποτυπώνεται η φρίκη του πολέμου, με τον Λευκορώσο καλλιτέχνη να ""δείχνει"" το πρόσωπο του ανθρώπου που έδωσε την εντολή να δολοφονηθούν άδικα τόσες χιλιάδες αθώοι άνθρωποι. “Τρόμος, πόνος, βάσανα, θάνατος, απανθρωπιά, κακία – όλα είναι σε αυτήν την εικόνα. Δεν καταλαβαίνω πώς οι άνθρωποι μπορούν να το υποστηρίξουν”, τόνισε ο φωτογράφος που ""συνέθεσε"" το πορτρέτο. Δείτε παρακάτω το πορτρέτο: Η δημοσίευση κοινοποιήθηκε από το χρήστη Pasha Kritchko (@pkritchko) Ακολουθήστε το News247.gr στο Google News και μάθετε πρώτοι όλες τις ειδήσεις"	news247
145	Ουκρανία: Νέες επιθέσεις στο Αζοφστάλ - Εντείνονται οι βομβαρδισμοί στο Λουγκάνσκ 	 Νέες επιθέσεις εξαπολύει η Ρωσία στην Ανατολική Ουκρανία ενώ άμαχοι άρχισαν συγκεντρώνονται κοντά σε εμπορικό κέντρο της Μαριούπολης προκειμένου να την εγκαταλείψουν. Ουκρανικό μαχητικό στο Χάρκοβο κατέρριψε η Ρωσία.	                        ΚΟΣΜΟΣ	Βομβαρδισμένο κτίριο στο Τσερνίχιβ	https://www.news247.gr/img/3586/9607385/098000/w660/660/vomvardismoi1.jpg	2022-04-23 13:53	"Οι ρωσικές δυνάμεις άρχισαν εκ νέου τα αεροπορικά πλήγματα και επιχειρούν επίθεση εναντίον του εργοστασίου χάλυβα της Μαριούπολης Αζοφστάλ, όπου βρίσκονται οι εναπομείνασες ουκρανικές δυνάμεις στην πόλη, είπε σήμερα ο Ουκρανός προεδρικός σύμβουλος Ολέξι Αρεστόβιτς. ""Ο εχθρός επιχειρεί να καταπνίξει την τελευταία αντίσταση των υπερασπιστών της Μαριούπολης στην περιοχή του Αζοφστάλ"", είπε ο Αρεστόβιτς στο εθνικό τηλεοπτικό δίκτυο. Την ίδια ώρα, όλες οι ελεγχόμενες από την Ουκρανία πόλεις στην ανατολική περιοχή Λουγκάνσκ δέχονται συνεχώς σήμερα βομβαρδισμό από τις ρωσικές δυνάμεις και το σφυροκόπημα εντείνεται, δήλωσε στην τηλεόραση ο κυβερνήτης της περιοχής Σερχίι Χαϊντάι. Ο ίδιος είπε ότι ουκρανικές δυνάμεις εγκαταλείπουν κάποιους οικισμούς για να ανασυγκροτηθούν αλλά ότι η κίνησή αυτή δεν ισοδυναμεί με σημαντικό πλήγμα. Ρωσία: Κατέρριψε ουκρανικό μαχητικό αεροσκάφος στο Χάρκοβο Το ρωσικό υπουργείο Άμυνας ανακοίνωσε σήμερα ότι οι δυνάμεις του κατέρριψαν ένα ουκρανικό μαχητικό αεροσκάφος Su-25 και κατέστρεψαν τρία ελικόπτερα MI-8 σε αεροδρόμιο στην περιοχή του Χαρκόβου της Ουκρανίας. Δεν υπήρξε άμεση αντίδραση από την ουκρανική πλευρά αναφορικά με τους ισχυρισμούς της Ρωσίας. Νέα προσπάθεια απομάκρυνσης αμάχων από τη Μαριούπολη Μια νέα προσπάθεια απομάκρυνσης αμάχων από τη Μαριούπολη, ένα μεγάλο μέρος της οποίας ελέγχεται από τον ρωσικό στρατό, σχεδιάζεται να γίνει σήμερα, όπως δήλωσε η αντιπρόεδρος της ουκρανικής κυβέρνησης Ιρίνα Βερεστσούκ. «Σήμερα, θα προσπαθήσουμε και πάλι να απομακρύνουμε γυναίκες, παιδιά και ηλικιωμένους», ανέφερε η Βερεστσούκ σε ανάρτησή της σε μέσα κοινωνικής δικτύωσης, διευκρινίζοντας ότι οι άμαχοι είχαν αρχίσει να συγκεντρώνονται κοντά σε εμπορικό κέντρο της πόλης και υπάρχουν ελπίδες ότι η απομάκρυνσή τους θα μπορέσει να ξεκινήσει γύρω στις 12.00 (τοπική ώρα και ώρα Ελλάδας). Η προσπάθεια αυτή γίνεται ενώ ο Ουκρανός πρόεδρος Βολοντίμιρ Ζελένσκι ζήτησε και πάλι χθες βράδυ μια παύση των συγκρούσεων προκειμένου να απομακρυνθούν οι άμαχοι από τις ουκρανικές πόλεις τις οποίες πολιορκούν ρωσικές δυνάμεις, ξεκινώντας από την Μαριούπολη. Ακολουθήστε το News247.gr στο Google News και μάθετε πρώτοι όλες τις ειδήσεις"	news247
