	title	lead	section_tag	Alternative_text	Image_url	date	body	editor
0	Τρομακτική πρόβλεψη Στόλτενμπεργκ: Ο πόλεμος στην Ουκρανία ίσως διαρκέσει χρόνια	"Δυσοίωνες είναι οι προβλέψεις του ΓΓ του NATO σχετικά με την εξέλιξη του πολέμου στην Ουκρανία. ""Θα μπορούσε να πάρει χρόνια"", τόνισε ο Γενς Στόλτενμπεργκ, υποστηρίζοντας παράλληλα πως η Συμμαχία θα συνεχίσει να στηρίζει το Κίεβο."	                        ΚΟΣΜΟΣ	Ουκρανοί στρατιώτες ανάμεσα σε ερείπια	https://www.news247.gr/img/1121/9599694/375000/w660/660/ukraine.jpg	2022-06-19 14:45	"Ο πόλεμος της Ρωσίας στην Ουκρανία ίσως και να διαρκέσει «χρόνια», προειδοποίησε ο Γενικός Γραμματέας του Οργανισμού του Συμφώνου του Βόρειου Ατλαντικού, ο Γενς Στόλτενμπεργκ, σε συνέντευξη που παραχώρησε στη γερμανική εφημερίδα Bild am Sonntag και δημοσιεύεται στο φύλλο της που κυκλοφορεί, προσθέτοντας ότι οι προμήθειες προηγμένων όπλων στα ουκρανικά στρατεύματα μπορεί να αυξήσει τις πιθανότητες το Ντονμπάς να αποσπαστεί από τον ρωσικό έλεγχο. «Πρέπει να προετοιμαστούμε για το γεγονός ότι θα μπορούσε να πάρει χρόνια. Δεν πρέπει να επιβραδύνουμε την υποστήριξη της Ουκρανίας», είπε ο κ. Στόλτενμπεργκ στην κυριακάτικη έκδοση της Bild όπως αναφέρει το ΑΠΕ-ΜΠΕ. «Ακόμη κι αν τα κόστη είναι υψηλά, όχι μόνο αυτά της στρατιωτικής υποστήριξης, αλλά και αυτά των αυξανόμενων τιμών της ενέργειας και των τροφίμων», πρόσθεσε ο Νορβηγός. Στη σύνοδο κορυφής του NATO στη Μαδρίτη αργότερα εντός του μηνός αναμένεται να συμφωνηθεί νέο πακέτο στρατιωτικής βοήθειας στην Ουκρανία που θα συμβάλει ο στρατός της να αφήσει πίσω τον εξοπλισμό της σοβιετικής εποχής και να αποκτήσει νατοϊκό εξοπλισμό, δήλωσε ο κ. Στόλτενμπεργκ. Η Ουκρανία δεσμεύτηκε το Σάββατο ότι οι δυνάμεις της θα νικήσουν αυτές της Μόσχας, την ώρα που βρίσκεται αντιμέτωπη με συνέχιση του σφυροκοπήματος πόλης στρατηγικής σημασίας στο Ντονμπάς και άλλες τοποθεσίες δέχθηκαν επιθέσεις με πυροβολικό και με πυραύλους. Την ίδια ώρα, ο πρόεδρος της χώρας Βολοντίμιρ Ζελένσκι δήλωσε ότι το ηθικό των στρατιωτών του παραμένει υψηλό και ότι δεν αμφιβάλλει για την νίκη επί των Ρώσων. Ουκρανία: Ο στρατός δηλώνει ότι απέκρουσε ρωσικές επιθέσεις κοντά στο Σεβεροντονέτσκ Τα ουκρανικά στρατεύματα ανέφεραν ότι απέκρουσαν ρωσικές επιθέσεις σε χωριά κοντά στο Σεβεροντονέτσκ, μια σημαντική πόλη στο ανατολικό τμήμα της χώρας, όπου διεξάγονται πολυαίμακτες μάχες ανάμεσα στους δύο στρατούς εδώ και εβδομάδες, ανακοίνωσαν σήμερα οι ένοπλες δυνάμεις του Κιέβου. ""Οι μονάδες μας απέκρουσαν την επίθεση στην περιοχή της Τοσκίβκα"", ανέφερε ο ουκρανικός στρατός. ""Ο στρατός υποχώρησε και ανασυντάσσεται"". Ο ουκρανικός στρατός πρόσθεσε πως οι ρωσικές δυνάμεις επιτέθηκαν στο χωριό Ορίχοβε, αλλά πως ""απέκρουσε με επιτυχία"" μια επίθεση κοντά στο χωριό αυτό. Το Σάββατο, αξιωματούχοι δήλωσαν πως αυτές οι σφοδρές μάχες διεξάγονταν σε περιοχές έξω από το Σεβεροντονέτσκ οι οποίες, σύμφωνα με τους ίδιους, είναι κυρίως, αλλά όχι πλήρως, υπό ρωσικό έλεγχο. ""Όλες οι δηλώσεις των Ρώσων σύμφωνα με τις οποίες ελέγχουν το Σεβεροντονέτσκ είναι ψέματα. Στην πραγματικότητα ελέγχουν το μεγαλύτερο μέρος της πόλης αλλά δεν την ελέγχουν πλήρως"", δήλωσε την Κυριακή ο τοπικός κυβερνήτης Σέρχιι Γκαϊντάι στο Telegram. Πρόσθεσε πως οι ρωσικές δυνάμεις ""ανασυγκροτούν συνεχώς τον στρατό τους με ενισχύσεις"", φέρνοντας νέα στρατεύματα στο Σεβεροντονέτσκ και στα περίχωρα. ""Χρησιμοποιούν τώρα τις λεγόμενες τακτικές εξερεύνησης, προσπαθούν να προχωρούν στάδιο το στάδιο, μέτρο το μέτρο"", πρόσθεσε. Οι ουκρανικές αρχές συνεχίζουν τις απομακρύνσεις κατοίκων από το Λισιτσάνσκ στην άλλη πλευρά του ποταμού Σεβεροντονέτσκ που αποτελεί στόχο σφοδρών βομβαρδισμών, είπε. Οι απομακρύνσεις από το Σεβεροντονέτσκ δεν είναι δυνατές εδώ και μέρες, μετά την καταστροφή της τελευταίας γέφυρας πάνω στον ποταμό που το συνδέει με το Λισιτσάνσκ. Όπως μεταδίδει το ΑΠΕ-ΜΠΕ, οι ουκρανικές αρχές δηλώνουν πως εκατοντάδες άνθρωποι έχουν καταφύγει για να προστατευθούν από τους βομβαρδισμούς στο χημικό εργοστάσιο Azot στο Σεβεροντονέτσκ. Ο Σέρχιι Γκαϊντάι δήλωσε πως το εργοστάσιο ""επλήγη δύο φορές"" σε 24 ώρες και πως ο ""σταθμός επεξεργασίας αποβλήτων"" της μονάδας έχει καταστραφεί. Ο ΟΗΕ προειδοποίησε την προηγούμενη εβδομάδα πως οι άμαχοι που βρίσκονται στο Σεβεροντονέτσκ δεν διαθέτουν πόσιμο νερό, τρόφιμα ή υγειονομικές εγκαταστάσεις. Ακολουθήστε το News247.gr στο Google News και μάθετε πρώτοι όλες τις ειδήσεις"	news247
1	"Ουκρανία: Ο Ζελένσκι επιχειρεί να ανυψώσει το ηθικό των Ουκρανών στρατιωτών-""Θα νικήσουμε"" "	Μετά την επίσκεψή του στην Μικολάγεφ, ο Βολοντίμιρ Ζελένσκι επανέλαβε την πίστη του ότι η Ουκρανία θα βγει νικήτρια από τον πόλεμο με τη Ρωσία. 	                        NEW ARTICLES	Βολοντίμιρ Ζελένσκι	https://www.news247.gr/img/2072/9664993/770000/w660/660/zelenskyy.jpg	2022-06-19 13:23	"Επιστρέφοντας από τη νότια γραμμή του μετώπου στην Ουκρανία, ο πρόεδρος της χώρας Βολοντίμιρ Ζελένσκι δήλωσε ότι το ηθικό των στρατιωτών του παραμένει υψηλό και ότι δεν αμφιβάλλει για τη νίκη τους επί των Ρώσων. Στη διάρκεια της σπάνιας αυτής επίσκεψης που πραγματοποιεί εκτός Κιέβου, όπου οχυρώθηκε στην αρχή της σύγκρουσης όταν η ουκρανική πρωτεύουσα απειλείτο από τον ρωσικό στρατό, ο Ζελένσκι μετέβη στην πόλη Μικολάγεφ στην Μαύρη Θάλασσα, επισκεπτόμενος τις ουκρανικές δυνάμεις που στρατοπεδεύουν κοντά και στην γειτονική περιφέρεια της Οδησσού. ""Δεν θα δώσουμε τον Νότο σε κανέναν, θα τα πάρουμε όλα πίσω και η θάλασσα θα είναι ουκρανική, θα είναι ασφαλής"", σημείωσε ο Ζελένσκι σε βίντεό του που αναρτήθηκε στο Telegram καθώς επέστρεφε στο Κίεβο. Οι ρωσικές δυνάμεις έχουν επικεντρώσει τις προσπάθειές τους στο ανατολικό και το νότιο τμήμα της Ουκρανίας τις τελευταίες εβδομάδες έπειτα από την αποτυχία τους να καταλάβουν το Κίεβο μετά την εισβολή τους στις 24 Φεβρουαρίου στην Ουκρανία. ""Οι απώλειες είναι σημαντικές. Πολλά σπίτια καταστράφηκαν, η εφοδιαστική αλυσίδα των πολιτών διαταράχθηκε, υπάρχουν πολλά κοινωνικά προβλήματα"", δήλωσε επίσης ο Ζελένσκι. ""Ζήτησα να υπάρξει στήριξη για τους ανθρώπους που έχασαν αγαπημένα τους πρόσωπα εν γένει. Οπωσδήποτε θα τα ξαναχτίσουμε όλα όσα καταστράφηκαν. Η Ρωσία δεν έχει τόσους πυραύλους για να μπορεί να λυγίσει την επιθυμία για ζωή του λαού μας"", τόνισε. Ο Ουκρανός πρόεδρος ευχαρίστησε τους στρατιώτες που συνεχίζουν να απωθούν τα ρωσικά στρατεύματα, τα οποία υποστηρίζονται στα ανατολικά από την προσαρτημένη Κριμαία, για την ""ηρωϊκή υπηρεσία"" που προσφέρουν. ""Η ζωή σας είναι σημαντική. Όσο είστε εσείς ζωντανοί, υπάρχει ένα ισχυρό ουκρανικό τείχος που προστατεύει τη χώρα μας"", τους είπε. Βίντεο που μεταδόθηκε από την ουκρανική προεδρία παρουσιάζει τον Ζελένσκι στο Μικολάγεφ μαζί με τον τοπικό κυβερνήτη Βιτάλι Κιμ, καθώς στέκονται στην πρόσοψη του κτιρίου της έδρας της περιφερειακής διοίκησης, το οποίο είχε δεχθεί ρωσικό πλήγμα τον Μάρτιο που προκάλεσε τον θάνατο 37 ανθρώπων. Η βιομηχανική αυτή πόλη-λιμάνι με τους σχεδόν μισό εκατομμύριο κατοίκους πριν από τον πόλεμο εξακολουθεί να τελεί υπό ουκρανικό έλεγχο, αλλά βρίσκεται κοντά στην περιφέρεια της Χερσώνας, η οποία έχε καταληφθεί από τους Ρώσους. Ρωσικό πλήγμα εκεί την Παρασκευή προκάλεσε τον θάνατο δύο ανθρώπων και τον τραυματισμό είκοσι. Το Μικολάγεφ εξακολουθεί να αποτελεί στόχο της Μόσχας, καθώς βρίσκεται στο δρόμο προς την Οδησσό, το μεγαλύτερο λιμάνι της Ουκρανίας, το οποίο παραμένει επίσης υπό ουκρανικό έλεγχο, ενώ αποτελεί το επίκεντρο των συζητήσεων που γίνονται για τις εξαγωγές εκατομμυρίων τόνων ουκρανικών σιτηρών που έχουν αποκλειστεί. Ακολουθήστε το News247.gr στο Google News και μάθετε πρώτοι όλες τις ειδήσεις"	news247
2	Μπόρις Τζόνσον: Πρόταση σε Ζελένσκι για πρόγραμμα εκπαίδευσης Ουκρανών στρατιωτών	"Υπό άκρα μυστικότητα και η δεύτερη επίσκεψη του Βρετανού πρωθυπουργού στο Κίεβο. ""Σπουδαίο φίλο της χώρας"", τον χαρακτήρισε ο Ουκρανός πρόεδρος."	                        ΚΟΣΜΟΣ	Οι Μπόρις Τζόνσον και Βολοντίμιρ Ζελένσκι	https://www.news247.gr/img/1568/9669722/365000/w660/660/zelenski-johnson.jpg	2022-06-17 23:42	Ο Bρετανός πρωθυπουργός Μπόρις Τζόνσον πρότεινε την έναρξη ενός μεγάλου προγράμματος εκπαίδευσης των ουκρανικών ενόπλων δυνάμεων - με δυνατότητα εκπαίδευσης έως και 10.000 στρατιωτών κάθε 120 ημέρες - κατά τη συνάντηση που είχε την Παρασκευή (17/06) με τον Ουκρανό πρόεδρο Βολοντίμιρ Ζελένσκι, όπως ανακοινώθηκε από τη Ντάουνινγκ Στριτ. Ο Τζόνσον, ο οποίος ταξίδεψε στο Κίεβο υπό άκρα μυστικότητα, δήλωσε ότι σκοπός της επίσκεψης είναι να στείλει «ένα απλό και ξεκάθαρο μήνυμα προς τον ουκρανικό λαό: το Ηνωμένο Βασίλειο είναι στο πλευρό σας και θα είμαστε στο πλευρό σας μέχρι την τελική σας επικράτηση». Οι δύο ηγέτες συζήτησαν για τις προμήθειες οπλικών συστημάτων και την περαιτέρω οικονομική ενίσχυση της Ουκρανίας, καθώς και για την επιβολή επιπλέον κυρώσεων σε βάρος της Ρωσίας, όπως έγινε γνωστό από την ουκρανική προεδρία. Ο πρόεδρος της Ουκρανίας καλωσόρισε τον πρωθυπουργό της Βρετανίας, χαρακτηρίζοντας «σπουδαίο φίλο» τον Μπόρις Τζόνσον. «Πολλές ημέρες αυτού του πολέμου έδειξαν ότι η υποστήριξη της Μεγάλης Βρετανίας προς την Ουκρανία είναι ακλόνητη και αποφασιστική. Χαίρομαι που βλέπω τον σπουδαίο φίλο της χώρας μας, Μπόρις Τζόνσον, ξανά στο Κίεβο», δήλωσε ο Ζελένσκι. Αυτή είναι η δεύτερη φορά που ο Μπόρις Τζόνσον επισκέπτεται το Κίεβο μετά την έναρξη της ρωσικής εισβολής στην Ουκρανία, στις 24 Φεβρουαρίου. Ακολουθήστε το News247.gr στο Google News και μάθετε πρώτοι όλες τις ειδήσεις	news247
3	"Ουκρανία: ""Προσπάθεια εξαπάτησης οι προτάσεις της Ρωσίας για νέο γύρο συνομιλιών"""	"Ως μια ""προσπάθεια εξαπάτησης της διεθνούς κοινότητας"" χαρακτηρίζει το Κίεβο τις προτάσεις της Ρωσίας για νέο γύρο ειρηνευτικών συνομιλιών. Ετοιμάζεται ""να μαχαιρώσει πισώπλατα"" την Ουκρανία."	                        ΚΟΣΜΟΣ	Διασώστες ανασύρουν πτώματα από τα συντρίμμια στην Ουκρανία	https://www.news247.gr/img/227/9668496/841000/w660/660/oukrania.jpg	2022-06-17 01:36	"Ο Μιχαΐλο Ποντολιάκ, σύμβουλος του ουκρανού προέδρου Βολοντίμιρ Ζελένσκι, απέρριψε σήμερα τα τελευταία σχόλια από τη Ρωσία ότι η Μόσχα είναι έτοιμη για επανέναρξη των ειρηνευτικών συνομιλιών με το Κίεβο, κάνοντας λόγο για «προσπάθεια εξαπάτησης της διεθνούς κοινότητας». Η Ρωσία, ανέφερε ο Ποντολιάκ σε διαδικτυακή ανάρτησή του, θέλει να δώσει την εντύπωση ότι είναι έτοιμη για διάλογο ενώ ετοιμάζεται «να μαχαιρώσει πισώπλατα» την Ουκρανία. Το Κίεβο σίγουρα θα επέστρεφε στο τραπέζι των διαπραγματεύσεων για την εξέλιξη της ρωσικής εισβολής, αλλά μόνο την κατάλληλη χρονική στιγμή, συμπλήρωσε. Η Ρωσία κατηγορεί την Ουκρανία για ""μπλόκο"" στην απομάκρυνση αμάχων από το Σεβεροντονέτσκ Η Ρωσία κατηγόρησε σήμερα τις ουκρανικές δυνάμεις ότι εμπόδισαν την απομάκρυνση αμάχων μέσω ενός «ανθρωπιστικού διαδρόμου» από ένα εργοστάσιο στο Σεβεροντονέτσκ, πόλη στην ανατολική Ουκρανία. «Η ρωσική πλευρά παρείχε έναν ανθρωπιστικό διάδρομο για να επιτρέψει την απομάκρυνση αμάχων από το εργοστάσιο χημικών Αζότ στο Σεβεροντονέτσκ. Παρά όλα αυτά τα μέτρα, (...) οι αρχές του Κιέβου απέτρεψαν με κυνισμό την ανθρωπιστική επιχείρηση», κατηγόρησε το ρωσικό υπουργείο Άμυνας σε ανακοίνωσή του. Χθες Τρίτη, η Ρωσία ανακοίνωσε ότι θα δημιουργήσει έναν «ανθρωπιστικό διάδρομο» σήμερα Τετάρτη από τις 08:00 έως τις 20:00 (τοπική ώρα και ώρα Ελλάδας) για να επιτρέψει σε αμάχους που έχουν βρει καταφύγιο στο εργοστάσιο Αζότ να εγκαταλείψουν το Σεβεροντονέτσκ προς την κατεύθυνση εδαφών που ελέγχονται από τις δυνάμεις της Μόσχας στο βορρά. Το ρωσικό υπουργείο Άμυνας, ωστόσο, κατηγόρησε τις ουκρανικές δυνάμεις ότι «παραβίασαν την κατάπαυση του πυρός πολλές φορές» και ότι «χρησιμοποίησαν την για ανθρωπιστικούς λόγους εκεχειρία για να αναπτυχθούν εκ νέου σε πιο ευνοϊκές θέσεις (μάχης)». Δεν ήταν δυνατή η ανεξάρτητη επαλήθευση αυτών των ισχυρισμών. Μια στρατηγική πόλη στην ανατολική Ουκρανία, το Σεβεροντονέτσκ, είναι εδώ και εβδομάδες σκηνικό σφοδρών συγκρούσεων μεταξύ του ουκρανικού στρατού και των δυνάμεων της Μόσχας καθώς και των φιλορώσων αυτονομιστών συμμάχων τους. Σύμφωνα με τις ουκρανικές αρχές, πολλές εκατοντάδες άνθρωποι έχουν βρει καταφύγιο στο εργοστάσιο Αζότ, το οποίο το Κίεβο ισχυρίζεται ότι βομβαρδίζεται συνεχώς. Αυτή η κατάσταση θυμίζει, σε μικρότερη κλίμακα, αυτό που συνέβαινε στο συγκρότημα της χαλυβουργίας Αζοφστάλ στη Μαριούπολη, ένα μεγάλο λιμάνι στα νοτιοανατολικά, το οποίο έπεσε στα χέρια των Ρώσων τον Μάιο μετά από πολλές εβδομάδες πολιορκίας. Εκατοντάδες άμαχοι είχαν καταφύγει στις υπόγειες στοές στο Αζοφστάλ, πριν βρεθούν παγιδευμένοι εκεί, δίπλα σε Ουκρανούς μαχητές. Η Ρωσία είχε επανειλημμένα ανακοινώσει τη δημιουργία ανθρωπιστικών διαδρόμων για την απομάκρυνση αμάχων, αλλά πολλές συμφωνίες κατέρρευσαν, με τη Μόσχα και το Κίεβο να αλληλοκατηγορούνται ότι τις παραβίασαν. Ακολουθήστε το News247.gr στο Google News και μάθετε πρώτοι όλες τις ειδήσεις"	news247
