	title	lead	section_tag	Alternative_text	Image_url	date	body	editor
96	Μπλίνκεν μετά τη συνάντηση με Ζελένσκι: Η Ρωσία έχει ήδη αποτύχει	Η Ουκρανία μπορεί να κερδίσει τον πόλεμο «αν έχει καλό εξοπλισμό», δήλωσε ο Αμερικανός υπουργός Άμυνας Όστιν, έπειτα από επίσκεψη που πραγματοποίησε χθες Κυριακή στο Κίεβο μαζί με τον ΥΠΕΞ των ΗΠΑ, Άντονι Μπλίνκεν.	                        ΚΟΣΜΟΣ	Λόιντ Όστιν, Βολοντίμιρ Ζελένσκι και Άντονι Μπλίνκεν	https://www.news247.gr/img/8370/9608899/776000/w660/660/ukraine.jpg	2022-04-25 13:33	"Η Ουκρανία μπορεί να κερδίσει τον πόλεμο με τη Ρωσία αν διαθέτει καλό εξοπλισμό, δήλωσε σήμερα ο Αμερικανός υπουργός Άμυνας Λόιντ Όστιν, έπειτα από επίσκεψη που πραγματοποίησε χθες Κυριακή στο Κίεβο μαζί με τον υπουργό Εξωτερικών Άντονι Μπλίνκεν. ""Το πρώτο πράγμα για να κερδίσει κανείς είναι να πιστεύει ότι μπορεί να το πράξει. Και εκείνοι (σ.σ. οι Ουκρανοί) είναι βέβαιοι ότι μπορούν να κερδίσουν"", επεσήμανε ο Όστιν μιλώντας σε μερικούς δημοσιογράφους. ""Μπορούν να κερδίσουν αν έχουν καλό εξοπλισμό, καλή υποστήριξη"", πρόσθεσε μετά τη χθεσινή του επίσκεψη στο Κίεβο στη διάρκεια της οποίας ο ίδιος και ο Μπλίνκεν συναντήθηκαν με τον Ουκρανό πρόεδρο Βολοντίμιρ Ζελένσκι. ""Στο επίκεντρο της συνάντησης ήταν οι συνομιλίες για τα πράγματα που θα μας βοηθήσουν να κερδίσουμε την τρέχουσα μάχη και επίσης να χτίσουμε για το αύριο"", εξήγησε ο Αμερικανός υπουργός, χαρακτηρίζοντας τη συνάντηση ""εποικοδομητική"". Σύμφωνα με τον Όστιν, ο Ζελένσκι είναι ευγνώμων για όσα κάνουν οι ΗΠΑ για να βοηθήσουν τη χώρα του, ενώ πρόσθεσε ότι η φύση των μαχών έχει αλλάξει και για τον λόγο αυτό η Ουκρανία έχει ανάγκη από όπλα μεγάλου βεληνεκούς, ενώ το Κίεβο επεσήμανε ότι χρειάζεται άρματα μάχης. Σε ό,τι αφορά τα όπλα που προσφέρουν οι ΗΠΑ στην Ουκρανία, ο Αμερικανός υπουργός Άμυνας σχολίασε ότι η Ουάσινγκτον είναι δύσκολο να παρακολουθεί τι συμβαίνει με αυτά καθώς δεν υπάρχουν αμερικανικές δυνάμεις επί του πεδίου, όμως τόνισε ότι ζήτησε από τους Ουκρανούς να παρακολουθούν όσο καλύτερα γίνεται πού πάνε αυτά τα όπλα. ""Θέλουμε να δούμε τη Ρωσία αποδυναμωμένη σε τέτοιο βαθμό ώστε να μην μπορεί να κάνει αντίστοιχα πράγματα όπως η εισβολή στην Ουκρανία"", υπογράμμισε ο Όστιν. ""Έχει ήδη χάσει πολλές από τις στρατιωτικές της ικανότητες και πολλά στρατεύματα για να είμαστε ειλικρινείς και δεν επιθυμούμε να καταφέρει να αποκαταστήσει γρήγορα αυτές τις ικανότητές της"", σημείωσε. Από την πλευρά του ο Άντονι Μπλίνκεν εκτίμησε ότι ""η Ρωσία δεν έχει πετύχει τους στρατιωτικούς της στόχους, η Ρωσία έχει ήδη αποτύχει και η Ουκρανία έχει ήδη πετύχει"". ""Είδαμε ανθρώπους στους δρόμους του Κιέβου, απόδειξη ότι η μάχη για το Κίεβο έχει κερδιθεί"", υπογράμμισε ο ίδιος, σχολιάζοντας ωστόσο ότι ""αυτό έρχεται σε μεγάλη αντίθεση με τα όσα συμβαίνουν σε άλλες περιοχές της Ουκρανίας, στα νότια και τα αντολικά, όπου η ρωσική βιαιότητα είναι απλώς φρικτή"". Ακολουθήστε το News247.gr στο Google News και μάθετε πρώτοι όλες τις ειδήσεις"	news247
97	"Ζελένσκι για νίκη Μακρόν: ""Συγχαρητήρια σε έναν αληθινό φίλο της Ουκρανίας"""	Ο Ουκρανός πρόεδρος συνεχάρη τον Γάλλο ομόλογό του για την νίκη του στις εκλογές ενώ εξέφρασε ευγνωμοσύνη για την υποστήριξή του από την έναρξη της ρωσικής εισβολής.	                        ΚΟΣΜΟΣ	Βολοντίμιρ Ζελένσκι	https://www.news247.gr/img/2491/9608750/602000/w660/660/zelenskyy.jpg	2022-04-25 08:48	Ο Ουκρανός πρόεδρος Βολοντίμιρ Ζελένσκι συνεχάρη σήμερα τον Γάλλο ομόλογό του Εμανουέλ Μακρόν για την επανεκλογή του. «Συγχαρητήρια στον Εμανουέλ Μακρόν, αληθινό φίλο της Ουκρανίας, για την επανεκλογή του!», ανέφερε ο κ. Ζελένσκι μέσω Twitter. «Του εύχομαι νέες επιτυχίες για το καλό του (γαλλικού) λαού. Εκτιμώ την υποστήριξή του και είμαι πεπεισμένος ότι μαζί θα προχωρήσουμε προς νέες κοινές νίκες. Προς μια ισχυρή και ενωμένη Ευρώπη!», πρόσθεσε. Οι κ.κ. Μακρόν και Ζελένσκι έχουν συνομιλήσει επανειλημμένα μετά την έναρξη της ρωσικής εισβολής στην Ουκρανία την 24η Φεβρουαρίου. Η Γαλλία έχει εφοδιάσει τον στρατό της Ουκρανίας με όπλα αξίας τουλάχιστον 100 εκατομμυρίων ευρώ, ιδίως με αντιαρματικούς πυραύλους Milan και πυροβόλα Caesar. Ακολουθήστε το News247.gr στο Google News και μάθετε πρώτοι όλες τις ειδήσεις	news247
98	Επικοινώνησε με Ερντογάν ο Ζελένσκι - Στο επίκεντρο η ασφάλεια των αμάχων στη Μαριούπολη	Οι διαπραγματεύσεις μεταξύ Ρωσίας-Ουκρανίας και η απομάκρυνση τραυματιών και αμάχων από τη Μαριούπολη στο επίκεντρο της τηλεφωνικής επικοινωνίας Ερντογάν- Ζελένσκι. Εγγυήσεις ασφαλείας ζητά το Κίεβο. 	                        ΚΟΣΜΟΣ	Βολοντίμιρ Ζελένσκι - Ρετζέπ Ταγίπ Ερντογάν	https://www.news247.gr/img/7185/9608285/751000/w660/660/zelenski-erdogan.jpg	2022-04-24 16:38	Η Τουρκία είναι έτοιμη να παράσχει κάθε δυνατή βοήθεια κατά τη διάρκεια της διαπραγματευτικής διαδικασίας μεταξύ της Ουκρανίας και της Ρωσίας, δήλωσε ο πρόεδρος της χώρας Ρετζέπ Ταγίπ Ερντογάν στον Ουκρανό ηγέτη Βολοντίμιρ Ζελένσκι, κατά τη διάρκεια μιας τηλεφωνικής επικοινωνίας, έγινε σήμερα γνωστό από την τουρκική προεδρία. Ο Ερντογάν είπε ότι η απομάκρυνση των τραυματιών και αμάχων από τη Μαριούπολη πρέπει να διασφαλιστεί, προσθέτοντας πως η Τουρκία βλέπει καταρχήν θετικά το θέμα της εγγυήτριας χώρας. Η Ουκρανία επιδιώκει να της δοθούν εγγυήσεις ασφαλείας από διάφορες χώρες κατά τη διάρκεια των συνομιλιών. Από την πλευρά του, ο πρόεδρος της Ουκρανίας Βολοντίμιρ Ζελένσκι δήλωσε σήμερα ότι συνομίλησε με τον Τούρκο ομόλογό του Ρετζέπ Ταγίπ Ερντογάν, ενόψει των συνομιλιών του Τούρκου προέδρου με τον Ρώσο πρόεδρο Βλαντίμιρ Πούτιν. Ο Ζελένσκι είπε πως εκείνος και ο Ερντογάν συζήτησαν την ανάγκη άμεσης εκκένωσης των αμάχων από τη Μαριούπολη, μεταξύ άλλων από το εργοστάσιο Αζοφστάλ και την ανταλλαγή των Ουκρανών στρατιωτών που έχουν οχυρωθεί στο εργοστάσιο. Ακολουθήστε το News247.gr στο Google News και μάθετε πρώτοι όλες τις ειδήσεις	news247
99	Ουκρανία: Ανάσταση στη σκιά του πολέμου - Συγκλονιστικές εικόνες	Σήμερα, Κυριακή του Πάσχα, σηματοδοτούνται ακριβώς δύο μήνες από την ρωσική εισβολή στην Ουκρανία, και οι Ουκρανοί πολίτες στρέφονται στην πίστη, αναζητώντας παρηγοριά.	                        ΚΟΣΜΟΣ	Πόλεμος στην Ουκρανία	https://www.news247.gr/img/5849/9608247/765000/w660/660/ukraine2.jpg	2022-04-24 14:57	"Μαίνονται οι ρωσικές επιθέσεις, ακόμη και σήμερα ανήμερα του Πάσχα, ενώ οι Ουκρανοί σπεύδουν σε εκκλησίες για να γιορτάσουν την Ανάσταση του Θεανθρώπου, με το μήνυμα της αγάπης και της ειρήνης να είναι πιο επίκαιρο από ποτέ. Αυτή την Κυριακή σηματοδοτούνται, επίσης, ακριβώς δύο μήνες από τότε που η χώρα οδηγήθηκε σε αυτόν τον καταστροφικό πόλεμο, μετά την εισβολή των ρωσικών δυνάμεων στις 24 Φεβρουαρίου. Καθώς οι μάχες κλιμακώνονται στον Νότο και στα ανατολικά, πολλοί πολίτες στην Ουκρανία διαλέγουν την πίστη αναζητώντας παρηγοριά, ενώ άλλοι επιλέγουν να ταξιδέψουν στο σπίτι από τη γειτονική Πολωνία για να είναι ανάμεσα στα αγαπημένα τους πρόσωπα για τις εορταστικές εκδηλώσεις του Πάσχα. ""Δεν ήμουν ποτέ τόσο ευτυχισμένη στη ζωή μου. Όταν τελικά είδα ξανά τον σύζυγό μου, την πρώτη μου νύχτα εδώ, ένιωθα ότι αυτό ήταν ένα όνειρο"", λέει η Anna-Mariia Nykyforchyn, 25 ετών, στο CNN από το Lviv. Έγκυος εννέα μηνών, όταν ξέσπασε ο πόλεμος, η Nykyforchyn ήταν ένα από τα περισσότερα από πέντε εκατομμύρια άτομα που αναγκάστηκαν να φύγουν. Επέστρεψε πριν από δύο μέρες με το μωρό της στην αγκαλιά. ""Για μένα, ήταν εξαιρετικά σημαντικό να επιστρέψω στο σπίτι πριν από το Πάσχα"", λέει, προτού μοιραστεί τη χαρά της για την προοπτική να γνωρίσουν οι παππούδες του ζευγαριού τη νέα προσθήκη στην οικογένεια. ""Ήθελα πολύ να είμαστε μαζί. Μας δίνει ελπίδα ότι όλα θα πάνε καλά."" Μήνυμα Ζελένκσι για Πάσχα: Καμία ""κακία"" δεν θα καταστρέψει την Ουκρανία Ο Ουκρανός πρόεδρος Βολοντίμιρ Ζελένσκι δεσμεύθηκε σήμερα στο μήνυμά του για το Πάσχα ότι καμία «κακία» δεν θα καταστρέψει τη χώρα του και προσευχήθηκε ο Θεός να φέρει πίσω την ευτυχία στα παιδιά και παρηγοριά στις μητέρες που θρηνούν. Μπροστά από τον καθεδρικό ναό της Αγίας Σοφίας στο Κίεβο, μια εκκλησία ηλικίας 1.000 ετών, ο Ζελένσκι επεσήμανε σε μαγνητοσκοπημένο μήνυμά του προς τον ουκρανικό λαό ότι η χώρα θα ξεπεράσει το σκοτάδι που έχει φέρει ο πόλεμος. «Σήμερα εξακολουθούμε να πιστεύουμε στη νέα νίκη της Ουκρανίας και είμαστε όλοι πεπεισμένοι ότι δεν θα μας καταστρέψει καμία ορδή ή κακία», τόνισε ο Ζελένσκι φορώντας το χαρακτηριστικό χακί μπλουζάκι. «Θα ξεπεράσουμε τους σκοτεινούς καιρούς και σήμερα εγώ - όπως και οι περισσότεροι από εμάς - δεν φορώ φωτεινά χρώματα, αλλά πολεμάμε για μια φωτεινή ιδέα», πρόσθεσε. Ακολουθήστε το News247.gr στο Google News και μάθετε πρώτοι όλες τις ειδήσεις"	news247
100	"Μήνυμα Ζελένκσι για Πάσχα: Καμία ""κακία"" δεν θα καταστρέψει την Ουκρανία"	Μπροστά από τον καθεδρικό ναό της Αγίας Σοφίας στο Κίεβο, ο Ζελένσκι επεσήμανε σε μαγνητοσκοπημένο μήνυμά του προς τον ουκρανικό λαό ότι η χώρα θα ξεπεράσει το σκοτάδι που έχει φέρει ο πόλεμος.	                        ΚΟΣΜΟΣ	O Volodymyr Zelensky	https://www.news247.gr/img/5785/9608103/854000/w660/660/zelensky.jpg	2022-04-24 11:44	"Ο Ουκρανός πρόεδρος Βολοντίμιρ Ζελένσκι δεσμεύθηκε σήμερα στο μήνυμά του για το Πάσχα ότι καμία «κακία» δεν θα καταστρέψει τη χώρα του και προσευχήθηκε ο Θεός να φέρει πίσω την ευτυχία στα παιδιά και παρηγοριά στις μητέρες που θρηνούν. Μπροστά από τον καθεδρικό ναό της Αγίας Σοφίας στο Κίεβο, μια εκκλησία ηλικίας 1.000 ετών, ο Ζελένσκι επεσήμανε σε μαγνητοσκοπημένο μήνυμά του προς τον ουκρανικό λαό ότι η χώρα θα ξεπεράσει το σκοτάδι που έχει φέρει ο πόλεμος. «Σήμερα εξακολουθούμε να πιστεύουμε στη νέα νίκη της Ουκρανίας και είμαστε όλοι πεπεισμένοι ότι δεν θα μας καταστρέψει καμία ορδή ή κακία», τόνισε ο Ζελένσκι φορώντας το χαρακτηριστικό χακί μπλουζάκι. «Θα ξεπεράσουμε τους σκοτεινούς καιρούς και σήμερα εγώ - όπως και οι περισσότεροι από εμάς - δεν φορώ φωτεινά χρώματα, αλλά πολεμάμε για μια φωτεινή ιδέα», πρόσθεσε. Σήμερα, Κυριακή του Πάσχα, συμπληρώνονται δύο μήνες από την εισβολή της Ρωσίας στην Ουκρανία. Στο παρελθόν οι εκκλησίες της χώρας ήταν γεμάτες στη διάρκεια της βραδινής λειτουργίας της Ανάστασης και στη συνέχεια το πρωί της Κυριακής του Πάσχα. Όμως φέτος οι αρχές έχουν ζητήσει να μην συγκεντρωθούν πολλοί πιστοί στις εκκλησίες καθώς υπάρχει φόβος ότι θα αποτελέσουν στόχος των ρωσικών βομβαρδισμών. Σύμφωνα με τον Σερχίι Γκαϊντάι, τον κυβερνήτη της επαρχίας Λουχάνσκ, επτά εκκλησίες στην περιοχή έχουν καταστραφεί στη διάρκεια του πολέμου. Εξάλλου τουλάχιστον 213 παιδιά έχουν σκοτωθεί μέχρι στιγμής. «Δώσε σε κάθε αγόρι και σε κάθε κορίτσι μια χαρούμενη παιδική ηλικία, νεότητα και γηρατειά ώστε τουλάχιστον να σβήσουν οι αναμνήσεις της φρικτής παιδικής τους ηλικίας στη διάρκεια του πολέμου», προσευχήθηκε ο Ζελένσκι. «Φρόντισε τις μητέρες μας, δώσε υπομονή σε αυτές που περιμένουν έναν γιο ή μια κόρη να επιστρέψουν από τον πόλεμο», πρόσθεσε. «Δώσε υπομονή σε αυτούς που, δυστυχώς, δεν θα δουν τα παιδιά τους να επιστρέφουν από το μέτωπο». «Μην ξεχνάς τη Μαριούπολη και τους ηρωικούς της υπερασπιστές. Μπορεί να καταστραφούν οι τοίχοι, αλλά δεν μπορούν να καταστραφούν τα θεμέλια πάνω στα οποία βασίζεται το πνεύμα των μαχητών μας, το πνεύμα όλης της χώρας», κατέληξε. Ο Ποντολιάκ ζητά μια ""πραγματική, πασχαλινή εκεχειρία"" στη Μαριούπολη Ο Μιχαΐλο Ποντολιάκ, ο Ουκρανός διαπραγματευτής και σύμβουλος της ουκρανικής προεδρίας, δήλωσε σήμερα ότι οι ρωσικές δυνάμεις βομβαρδίζουν συνεχώς τη Μαριούπολη και κάλεσε τη Μόσχα να συμφωνήσει σε μια ""πραγματική, πασχαλινή εκεχειρία"" στην πόλη. ""Η Ρωσία επιτίθεται συνεχώς στο εργοστάσιο Azovstal της Μαριούπολης. Το σημείο όπου βρίσκονται οι πολίτες και ο στρατός μας βομβαρδίζεται από αέρος και από το πυροβολικό"", επεσήμανε ο Ποντολιάκ στο Twitter. Ο ίδιος κάλεσε τη Ρωσία ""να αναλογιστεί τα απομεινάρια της φήμης της"" και ζήτησε ""μια πραγματική, πασχαλινή εκεχειρία στη Μαριούπολη"", αλλά και την άμεση δημιουργία ανθρωπιστικού διαδρόμου για την απομάκρυνση των αμάχων και έναν ειδικό γύρο συνομιλιών ώστε να διευκολυνθεί η ανταλλαγή αιχμάλωτων στρατιωτικών και πολιτών. Ακολουθήστε το News247.gr στο Google News και μάθετε πρώτοι όλες τις ειδήσεις"	news247
